title,link,description,bloggername,bloggerlink,postdate
신생아유산균 시기 아기유산균<b>비타민D</b> 돌아기유산균 경험담,https://blog.naver.com/joy61062/224181909608,#아기유산균 #아기유산균<b>비타민D</b> #신생아유산균 신생아유산균 시기 아기유산균<b>비타민D</b> 돌아기유산균 비타슈넬 베이비드롭 안녕하세요 사랑스러운 두 아이를 키우고 있는 쁨남매맘입니다:) 육아를 하면서... ,행복한 김다니,blog.naver.com/joy61062,20260212
아기<b>비타민D</b> 아연 필수일까?,https://blog.naver.com/springjean/224163300059,#아기<b>비타민D</b> #아기유산균 아기<b>비타민D</b> 아연 필수일까? 초등학생인 우리 큰 아이를 보면서 문득 신생아 때가 떠올랐어요. 그때는 정말 하나하나 다 찾아보고 고민했던 것 같아요. 특히 아기<b>비타민D</b>는... ,"도담도담, 러브하우스 : )",blog.naver.com/springjean,20260129
<b>비타민D</b> 부족 확인한 후기,https://blog.naver.com/gwf21/224164566815,"<b>비타민D</b>를 고를 때 비타민K2가 함께 들어 있는지를 가장 먼저 확인했어요. D는 칼슘을 혈액 쪽으로... <b>비타민D</b>와 함께 섭취했을 때 항산화 측면에서 시너지가 있다고 해서, 성분 구성이 D·K2·셀렌 정도로 단순한... ",❤️MIN’s 의 다락방❤️,blog.naver.com/gwf21,20260129
<b>비타민D</b> 추천 받고 직접 선택해본 비타도스D 솔직 후기,https://blog.naver.com/dohyun0305/224182800175,"하루 대부분을 실내에서 보내다 보니 자연스럽게 비타민 관련 정보를 찾아보게 되었고, 주변에서도 어느 순간부터 “<b>비타민D</b> 챙겨 먹는다”는 이야기를 자주 듣게 되면서 저도 관심이 생겼어요. 저는 그동안... ",Calmness_,blog.naver.com/dohyun0305,20260213
임산부 <b>비타민D</b> 권장량 용량 부족 추천 뉴로랩스,https://blog.naver.com/sooheenam/224147582229,또 올리브오일을 부원료로 사용해서 지용성 비타민인 <b>비타민D</b> 흡수를 도와준다는 설명도 납득이 갔고요. 무부형제 공법이라 불필요한 합성향료나 착색료가 없다는 점도 임산부 입장에서는 중요한... ,"⭐"" 그리움의 부동산개발 """,blog.naver.com/sooheenam,20260115
<b>비타민D</b> 부족 증상 확인한 후기,https://blog.naver.com/king3799/224172291793,"① 비타민K2 포함 여부 <b>비타민D</b>는 칼슘 흡수와 관련이 있고, K2는 그 과정의 균형을 잡는 데 도움을... 셀렌이 <b>비타민D</b>와 함께 구성된 제품이 조합 면에서 부담이 덜해 보였어요. 그래서 성분은 D·K2·셀렌까지만... ",싱글벙글 소리 Story,blog.naver.com/king3799,20260205
착한가격의 DSM 원료사용? <b>비타민D</b>추천 (비타도스 솔직후기),https://blog.naver.com/midas8873/224181794947,"바로 <b>비타민D</b>추천 제품들이었어요. 특별한 이유가 있었던 건 아니고, 어느 날 친구와 이야기하다가 자연스럽게 <b>비타민D</b>추천 얘기가 나온 게 계기였어요. 실내에서 지내는 시간이 많으면 기본적인 관리 차원에서... ",김스토리,blog.naver.com/midas8873,20260212
뉴로랩스 <b>비타민D</b> 5000IU ( 3+1) 고품질 가성비 추천,https://blog.naver.com/myhongs/224156208859,"제가 겪었던 상황부터 말씀드리면, <b>비타민D</b> 부족 때문에 생각보다 훨씬 오래 고생했습니다. 어디가 딱... <b>비타민D</b> 수치가 많이 낮아요. 솔직히 그때까지는 <b>비타민D</b>를 뼈에만 좋은 영양소 정도로만 알고... ",'당신'이라는 콘텐츠,blog.naver.com/myhongs,20260122
아기<b>비타민D</b> 유산균 아연 보다 먼저 챙기세요,https://blog.naver.com/kthee0123/224169374307,의외로 <b>비타민D</b>였어요 특히 요즘처럼 미세먼지도 많고 실내에서 지내는 시간이 많은 아기들은 햇빛을 충분히 쬐기 어렵기 때문에 <b>비타민D</b> 결핍이 쉽게 올 수 있다고 하셨죠 <b>비타민D</b>는 단순히 뼈 성장만을 위한... ,언제나 너희뿐이야❤,blog.naver.com/kthee0123,20260202
WCS 칼슘 마그네슘 <b>비타민D</b> 섭취시간 케어 후기,https://blog.naver.com/ggomo882/224174982178,WCS 칼슘 마그네슘 <b>비타민D</b> 섭취시간 케어 후기 WCS 칼슘 마그네슘 <b>비타민D</b> 섭취시간 케어 후기 WCS 칼슘... 비타민 K2 유무 칼슘은 무조건 많이 먹는다고 좋은 게 아니라 어디에 정착하느냐가 중요해요. K2는 칼슘이... ,설.레.임,blog.naver.com/ggomo882,20260207
오메가3 <b>비타민D</b> 효과 부작용 섭취방법,https://blog.naver.com/jasonmoondistri/224179087114,오메가3 <b>비타민D</b> 효과 부작용 섭취방법 오메가3 <b>비타민D</b> 효과 부작용 섭취방법 오메가3 <b>비타민D</b> 효과 부작용 섭취방법 오메가3 <b>비타민D</b> 효과 부작용 섭취방법 혈압 수치가 신경 쓰이기 시작하면서부터 “이제는... ,"꾸준한 한걸음, 오늘보다 나은 내일을 기대합니다.",blog.naver.com/jasonmoondistri,20260210
<b>비타민D</b> 부족 온가족 뉴로랩스 <b>비타민D</b> 추천,https://blog.naver.com/54fany/224145509339,<b>비타민D</b>는 근육 기능 유지 면역세포 활성 염증 반응 조절 피로 회복 기분 안정 까지 관여하는 전신 호르몬에 가까운 비타민이었어요. 그래서 부족하면 쉽게 피로해지고 감기 잘 걸리고 근육통 잦고 기분도... ,꼬마왕자님과 놀고 먹고 즐기고,blog.naver.com/54fany,20260114
<b>비타민D</b> 하루권장량 및 정상수치 뉴로랩스 <b>비타민D</b> 후기,https://blog.naver.com/ie_jima/224139369550,그리고 그때 처음으로 <b>비타민D</b> 정상수치라는 걸 제대로 보게 됐습니다. 보통 혈중 25(OH)D 기준으로 30ng/mL 이상을 정상으로 본다고 하더라고요. 제 수치는 그 기준에 한참 못 미쳤습니다. 이쯤 되니 이건 그냥... ,세여자 모시고 살기,blog.naver.com/ie_jima,20260109
오메가3 <b>비타민D</b> 효능 복용법 섭취시간까지,https://blog.naver.com/mallangjuice/224182056508,오메가3 <b>비타민D</b> 효능 복용법 섭취시간까지 오메가3 <b>비타민D</b> 효능 복용법 섭취시간까지 오메가3 <b>비타민D</b> 효능 복용법 섭취시간까지 1. 초기 고민과 제품을 찾게 된 계기 최근 몇 달 사이에 생활 패턴이 크게... ,마마말랑의 뷰티 패션 블로그,blog.naver.com/mallangjuice,20260213
<b>비타민D</b> 부족 증상 개선한 후기,https://blog.naver.com/dbsgmlx/224162946702,"저는 <b>비타민D</b>를 고를 때 비타민K2 함유 여부를 먼저 봤어요. D는 칼슘을 혈액으로 보내고, K2는 뼈로... <b>비타민D</b>와 같이 섭취했을 때 항산화 시너지가 난다고 해서, 성분은 D·K2·셀렌까지만 있는 구성이 좋았어요.... ",구니의 블로그,blog.naver.com/dbsgmlx,20260128
WCS 칼슘 마그네슘 <b>비타민D</b> 섭취시간 복용방법 후기,https://blog.naver.com/liebecafe/224177673727,WCS 칼슘 마그네슘 <b>비타민D</b> 섭취시간 복용방법 후기 WCS 칼슘 마그네슘 <b>비타민D</b> 섭취시간 복용방법 후기... 비타민 K2 동반 여부 칼슘은 ‘얼마나 먹느냐’보다 ‘어떻게 활용되느냐’가 더 중요하다고 느꼈어요.... ,The Ashley House,blog.naver.com/liebecafe,20260209
<b>비타민D</b> 4000 부족증상 및 하루 섭취량 기준 정리,https://blog.naver.com/gwf21/224170632810,"가장 먼저 확인한 건비타민K2가 함께 구성돼 있는지 여부였어요.<b>비타민D</b>가 칼슘을 혈액으로 이동시키는 역할을 한다면,K2는 그 칼슘이 뼈로 가도록 돕고혈관이나 연조직에 쌓이는 걸 줄여주는 쪽에... ",❤️MIN’s 의 다락방❤️,blog.naver.com/gwf21,20260203
<b>비타민D</b> 부족 증상 뉴로랩스 <b>비타민D</b> 5000IU 고함량,https://blog.naver.com/pms415/224147745402,올리브오일을 부원료로 사용해 지용성 비타민인 <b>비타민D</b> 흡수를 도와준다는 설명도 납득이 됐고요. 무부형제 공법이라 불필요한 성분이 없는 것도 마음에 들었습니다. 섭취는 정말 간단했습니다. 하루 한 캡슐.... ,신나는 나의 인생,blog.naver.com/pms415,20260115
<b>비타민D</b>4000 부족증상 권장량 섭취법 후기,https://blog.naver.com/an970405/224174304464,제품 선택 기준과 실제 복용 후 변화 과정 <b>비타민D</b> 제품 고를 때 가장 신경 쓴 건 성분 단순함이었어요. 불필요한 첨가물 최소화된 걸로 골랐고 비타민K2와 셀렌이 함께 들어간 뉴로랩스 덴시티아를... ,행복하고 행복하고 해피해♡,blog.naver.com/an970405,20260206
<b>비타민D</b> 4000 부족증상 및 하루 섭취 기준,https://blog.naver.com/iqeqamy/224172118680,"① 비타민K2 포함 여부 <b>비타민D</b>는 칼슘 흡수에 관여하고, 비타민K2는 그 칼슘이 뼈 쪽으로 이동하는 과정에 관여한다고 알려져 있잖아요. 그래서 K2가 함께 포함돼 있는지, 그리고 화학용매가 아닌 초임계 추출... ",[구르미],blog.naver.com/iqeqamy,20260205
